Aliment,Calorii,Proteine,Lipide,Carbohidrati,Fibre,AproximariPaste fainoase taitei Baneasa,350,11,0.7,75,0,
Paste fainoase tortelini cu ricotta si spanac Finno,285,10,6.5,46.8,0,1 buc = 6 g
"Paste fara gluten, din orez si porumb Riso Scotii",355,6.9,1.8,76.2,3,1 pachet  = 250 g
Paste farfalle Carrefour,366,12.5,1.5,75,2.5,1 portie=80 grame
Paste fusilli Baneasa,351,11,1.2,72.9,2.3,1 punga = 400 g
Paste fusilli n.98 Barilla,356,12,1.5,72.2,3,
Paste grau Esselunga,353,13,1.5,71.8,0,1 punga = 1 kg
Paste integrale Arrighi,337,12,1,68,6,1 pachet = 500 g
Paste integrale Ditali Probios,325,13,2.6,62.2,8.6,1 punga = 500 g
Paste integrale fusilli Divella,330,12,2.2,65.5,6,
Paste integrale Misura,335,13,1.5,67.5,6.4,
Paste integrale rustic SanoVita,328,9.3,1.7,66.6,7.5,
Paste macarron Alipende,338,12,2,68,0,
Paste papillons Pates d'Alsace Cora,373,15,5,67,0,
Paste penne 365,365,10,1,75,1.5,
Paste penne rigate Combino,360,12,1.3,73,3,1 punga = 500 g
Paste pipe rigate135 Novella,356,12,1.5,72,3,1 punga = 500 g
Paste Shirataki Orez din Konjac LCW,6,0,0,0.5,3,1 pachet = 200g
Paste Shiratakis din faina Konjac Karelea,16,0.5,0,2.3,3.4,
Paste spirale Domani,350,10,1.1,72,0,1 punga = 300 g
Paste tagliatelle cu spanac Barilla,347,12,1.5,71.4,3,
"Paste, 4 oua",392,15,3.4,72.9,3.2,
Pate de ficat de porc degresat La Piara,168,15,11,2.3,0,1 cutie = 73 g
Penne cu 5 legume Panzani,351,13.1,1.6,68,6.3,1 cutie = 400 g
Penne Gusturi Romanesti,360,12,2.2,72.6,0.7,1 punga = 500 g
Penne Pambac,355.2,11,0.8,75,2,1 punga = 400 g
Penne Rigate Completes Bio Casino,362,13,2,70,6,
Penne Rigate Kaufland,358,11.5,3.2,73.2,3,1 punga = 500 g
Penne Rigate Panzani,354,12,2,72,0,1 punga = 500 g
Perle Tapioca Sanovita,351,0,0.2,85.3,0,1 punga = 500 g
Pernute de cereale cu ciocolata si musli Dr. Oetker Vitalis,450,8.9,14.9,67.4,5,1 cutie = 425 g
Pesmet,342,10.2,0.9,73.3,3,
Pesmet alb Titan,369,12,1,78,0,
Pesmet Delhaizer,346,11,1.2,72.8,3.2,1 cutie = 200 g
Piscoturi cu oua Savoiardi,385,8.7,3.3,80.2,2.5,
Piscoturi Savoiardi Balocco,377,8.4,3.7,77.6,2.7,1 piscot = 8.33 g
Porumb dulce Bio BioNetto,70,3,1.5,10,2.3,
Porumb dulce K-Classic,91,2.9,2.4,12.2,4,
Porumb fiert Kaufland,89,2.9,2.5,11.2,2.8,
Premix pentru paine cu secara Pirifan,330,11.5,3,64.7,6.7,punga = 500g
Quinoa ,368,14.1,6.1,64.2,7,
Quinoa bio All Green,355,12.2,5.5,62.5,7,
Quinoa neagra Fruit Orchard,343,13.8,5,62,6.6,1 pachet = 1000 g
Quinoa Sano Vita,350,14.1,5.6,57.2,4.6,1 punga = 250 g
Rondele de grau Wheat Cakes Kaufland,365,14,1.9,68,10,1 buc = 7 g
Rondele de orez expandat cu aroma de caramel Stilla Fitness,377,6.1,0.9,84.8,2.2,1 rondea = 3 g
Rondele de orez expandat cu glazura de ciocolata Stilla Fitness,455,6.8,15.3,72.1,1.7,"1 rondea =3,5 g"
Rondele de orez naturale multicereale Good Food,380,8.7,4,75,5.5,1 rondea = 10 g
Rondele din grau expandat cu glazura de cacao SanoVita,446,9,13.1,68.5,0,1 buc = 19 g
Rondele din grau expandat cu glazura de iaurt SanoVita,457,9.2,15.3,69.9,0,1 bucata =19 g
Rondele din grau expandat Solaris,362,13.5,0.9,74,2,
Rondele grau expandat Stilla Fitness,340,11.4,0.8,70.3,13.3,1 buc = 10 g
Rondele orez expandat Bio Nature,387,7.5,3,81,3,
Rondele orez expandat K-Classsic,377,7.6,3,78,1,1 punga = 130 g
Seminte de chia SanoVita,491,21.8,31.3,11.7,25,
Seminte de in BIO Natura,586,18.3,42,30.4,27.3,
Soia boabe SanoVita,467,35,20,22,3,1 punga = 1000 g
Soia germeni,31,1.8,0.2,5.3,2,
Spaghete Baneasa,350,11,0.7,75,0,
Spaghete Classic Kaufland,358,11.5,1.5,73.2,3,
Spaghete crude,379,14,2.6,75.1,3.2,
Spaghete De Cecco,355,13,1.5,73,0,
Spaghete din grau dur Combino,358,12,1.3,73,3,1 pachet xxl = 600 g
Spaghete din grau dur Fior Di Pasta ,360,11.5,1.5,73.6,0,1 punga = 500 g
Spaghete integrale Baneasa,327,14,2,59,8,
Spaghete integrale Combino,351,12,1.9,68,6.8,1 punga = 500 g
Spaghete integrale din gris de grau dur Combino,351,12,1.9,68,6.8,1 pachet = 500 g
Spaghete integrale nr. 5 Barilla,351,12.5,2.5,66.7,6,
Spaghete integrale Tre Mulini,332,12.2,1.9,66.6,5,1 punga = 500g
Spaghete integrale Vollkorn Bio,330,12,2.2,65.5,0,
Spaghete no. 3 Barilla,359,12.8,2,70.9,3,1 cutie = 500 g
Spaghete Pambac,350,11,0.2,75,2,1 pachet = 500 g
Spaghete Reggia,358,12,1.3,73,2.9,1 punga = 500 g
Spaghetti integralli De Cecco,335,14,3,62.5,8,
Super fibre flakes bio Montignac,322,9.3,2.9,64.8,12.7,
Taitei Angel Hair din faina de Konjac si orez NoCarb Noodle,12,0.1,0,1.3,3,1 pachet = 300 g
Taitei chinezesti King Cook,459,9.3,15.5,70.6,3.4,1 punga = 450 g
Taitei cu ou si cu grau dur Monte Banato,363,14.3,1.5,73,0,1 punga = 200 g
Taitei de casa Pambac,362,12,1.6,75,0,
Taitei de orez nepreparati Vifon,345,5.6,0,80.6,0,1 pachet = 300 g
Taitei dietetici Baneasa,340,12.5,1.2,70.5,3.5,
Tarate de grau,216,15.6,4.3,64.5,42.8,1 lingurita = 4 g
Tarate de grau Inima Naturii,278,14.9,4.1,26.5,37.8,
Tarate de grau Pirifan,293,2.9,0.2,80.6,37,1 punga = 250 g
"Tarate de grau, orz, secara Solaris	",230,14.9,4.6,56.5,24,1 punga = 300 g
Tarate de orez Now Foods,462,19.8,19.8,52.8,13.2,
Tarate de ovaz eco Salim,330,16.6,8.6,46.6,16,1 lingura rasa = 9 g
Tarate de ovaz Hacendado,358,17.6,8.7,44.1,16.5,1 lingura = 10 g
Tarate de ovaz Sano Vita,326,17.6,8.7,60.6,16.5,1 pachet = 200 g
Tarate de ovaz Solaris ,246,17,7,60.4,15.4,
Tarate din grau bio All Green,267,16,4.7,17.7,45.1,1 pachet = 250 g
Tarate psyllium tranzit mix Pirifan,315,8.3,5.2,20.3,61,
Tartine de orez cu quinoa Lima,399,7.9,3.7,83.5,25,
Tartine din grau ecologic Risette Scotti,364,13.5,0.9,74,1,
Tartine din orez Carrefour ,381,8,2.8,81,3,
Tartine integrale Auchan,386,11,4,73.2,6.5,1 felie = 5 g
Tortellini al formaggio Monte Castello,392,12.9,9.1,63.2,2.8,1 punga = 250 g
Tortellini cu ciuperci Monte Banato,330,13.9,5.4,56.5,0,1 punga = 250 g
Tortelloni fini Modena,304,14.3,8.5,42.5,0,1 cutie = 250 g
Tortilla din faina de grau Poco Loco,332,9.3,8,54.2,0,1 bucata = 62 g
Wafe din orez expandat cu iaurt Hig,487,5.6,20.6,69.8,0,
Wafe orez cu susan Hig,386,9.4,2.8,80.7,0,
Wafe sare de mare Hig,390,8.6,3.5,81,0,
